<!ELEMENT class (student*)>
<!ELEMENT student (name, branch, cgpa)>
<!ATTLIST student id ID #REQUIRED>
<!ELEMENT name (#PCDATA)>
<!ELEMENT branch (#PCDATA)>
<!ELEMENT cgpa (#PCDATA)>
